title,id,author,created_utc,distinguished,edited,is_self,link_flair_text,num_comments,saved,score,selftext,stickied,upvote_ratio,url,subreddit
Career Advice,15cdu88,meetnhouse,1690590051.0,,False,True,Career,2,False,1,"Hi everyone, I am looking for some career advice. I got my undergraduate B.S in Psychology, so I used a bit of R, but in general I'm pretty new to data science. As you may have guessed, the jobs I was presented with upon graduation weren't very lucrative or exciting. I'm now working for a university that has offered to pay for my Master's Degree. I am having a tough time deciding between Data Analytics and User Center Design. I originally was drawn to UCD due to its mix of tech, data, and psychology, but some people have told me the job market for UCD/UX/UI can be tough starting out. 

At the end of the day, I would just like a job with decent pay, interesting projects, and WFH opportunities. So, if anyone can give me insight into what your job is like and what the job market is like, that would really help me make my decision.  ",False,1.0,https://www.reddit.com/r/datascience/comments/15cdu88/career_advice/,datascience
Interview Advice: White Board Interview,15c0lov,mlbatman,1690558125.0,,False,True,Career,1,False,4,"Hi Fellow DS',

Just need some input on a upcoming whiteboard interview, I am through 3 rounds already so really wanna ace this. It's for a mid-size app company. They have informed in advance that it is going to be around a Case-study on Text Classification. 

  
Any inputs from people who conduct these on a regular basis and what sort of answers do you expect from the candidates and what makes candidates stand out ? I am going to revise the concepts etc.  


What else can I do to be prepared well ?

&#x200B;",False,1.0,https://www.reddit.com/r/datascience/comments/15c0lov/interview_advice_white_board_interview/,datascience
Does anyone use their data science skills outside of work?,15c554j,Computer_Engineeeeer,1690568754.0,,False,True,Discussion,11,False,2,"I imagine data science can be useful to make optimal decisions outside of work?  Maybe optimal times to buy plane/concert tickets, optimal places to rent/buy a mortgage base on numerous factors, etc",False,0.75,https://www.reddit.com/r/datascience/comments/15c554j/does_anyone_use_their_data_science_skills_outside/,datascience
Seeking guidance for data modeling scheme creation,15canou,Fragrant-Switch-9881,1690581887.0,,False,False,Projects,4,False,0,,False,0.5,https://i.redd.it/xl8g14cx3seb1.jpg,datascience
Has anyone in this sub used databricks?,15c41e5,0ptimystic33,1690566139.0,,False,True,Discussion,3,False,2,"Is there any documentation on it or any thing I should know, I keep seeing ads for it.",False,1.0,https://www.reddit.com/r/datascience/comments/15c41e5/has_anyone_in_this_sub_used_databricks/,datascience
Recommendation on studying Deep Learning (Theory + Implementation) / Alternate to Deep Learning Specialization by Andrew Ng?,15bz0po,Total-Opposite-8396,1690554504.0,,False,True,Discussion,4,False,3,"I've just finished Machine Learning Specialization by Andrew Ng and I'm planning to dive deeper into Deep Learning concepts, theory, and implementation. I would like to get deeper insights and more understanding of the fundamental mathematical concepts of NN and DL models and build better intuition of how these models work. I also want to understand theoretically, how more neurons capture non-linear relationships in data and what exactly is hierarchical representation of data and how hidden layers form and learn from these abstract representations of data. Apart from theory, I also want to learn the implementation of these models. I have some exposure to TF library, but I'm okay to learn Pytorch too, if needed.

I need course or any sort of content recommendation on what are the best options to learn all this. So far, I've got recommendations for Deep Learning Specialization by Andrew Ng, but I would love to hear any alternate option or anything that I can do side by side this specialization.

Thanks!",False,0.8,https://www.reddit.com/r/datascience/comments/15bz0po/recommendation_on_studying_deep_learning_theory/,datascience
"best way to compare multiple time series trends, that isn't on a graph?",15c7at7,garbage_gemlin,1690573822.0,,False,True,Discussion,3,False,1,"Hi, I have 2 datasets that have about 900 variables over a period of 10 years. The variables and the years are the same in the two datasets, but the values are different due to how they have been processed. I need to compare the two time series for all 900 variables and identify if they are similar or not.

I normally would plot the two time series in a line graph and then look at them, but obviously this isn't feasible for this scale of variables.

I have been researching the best way to handle this. ideally i would end up with 1 value per variable that tells me whether the time series is similar or not. i was considering plotting the line of best fit for each time series and then calculating the slope and then comparing the two slope numbers per variable - does that make sense?

I have also read that you can extract the trend of a time series, but it still has been showing that on a graph and not as something with a numerical result that can be compared to another numerical result.

If anybody has any advice, tips, even any ideas of the best thing to google to learn more about how i should handle this, that would be much appreciated!

Also, I am using python for this, so python specific advice welcomed, but i also am happy to receive general advice that isn't specific to python.",False,1.0,https://www.reddit.com/r/datascience/comments/15c7at7/best_way_to_compare_multiple_time_series_trends/,datascience
Racial Demographics Dataset for US Cities,15c1fht,elharne,1690560021.0,,False,True,Projects,3,False,2,"I'm need a dataset that has racial demographics for US cities with a population over 40,000. If I could find one that has a lower bound less than 40k, that would work as well with some cleaning up. Does anyone know where I should look? Obviously [census.gov](https://census.gov) will likely have what I'm looking for, but would love suggestions on how to consolidate the data set to just what I'm looking for (the five census designated racial categories for each city w/pop 40,000+). ",False,1.0,https://www.reddit.com/r/datascience/comments/15c1fht/racial_demographics_dataset_for_us_cities/,datascience
Courses,15c6m9x,Interesting-Ear333,1690572209.0,,False,True,Career,1,False,1,Comprehensive course for Data analytics?? I'm a beginner who wants to shift my career.,False,1.0,https://www.reddit.com/r/datascience/comments/15c6m9x/courses/,datascience
Need suggestions,15buz1r,No-Attitude2715,1690544193.0,,False,True,Discussion,3,False,3,"I have a task to identify whether certain combinations of system configurations lead to system crashes or not. The data are collected from N systems, and the K binary features indicate whether a given configuration is present or not. Naturally, majority of the instances have no system crashes reported and some has. As stated above my goal is to identify what system configurations may lead to a crash. 

I first  modeled this as a binary classification problem with the intention of  using feature importance to identify the configurations that may  lead to a crash. But the resulting model does not have good precision for the minority class (after class balancing with xgboost it’s around 0.45). (I tried few other classification algorithms too)

Since my objective is not to develop a classifier, I am trying to figure out what other techniques I can employ here. For example, model agnostic feature selection methods, outlier detection,  bayesian nets etc. 

Please share any  thoughts you might have on how to approach this problem better. Thank you!",False,0.81,https://www.reddit.com/r/datascience/comments/15buz1r/need_suggestions/,datascience
"Call me a madman but, doesn’t train_test_split exist?",15b9ef0,Careful_Engineer_700,1690482409.0,,False,False,Discussion,135,False,76,,False,0.68,https://i.redd.it/ozyywia4wjeb1.jpg,datascience
do you need to have any social media to be a data scientist?,15bybfg,ezpax,1690552897.0,,1690647585.0,True,Discussion,43,False,2,"ive been interested in data science for a good while now, but i’m really not a social media fan by any means (i mostly use reddit for answers and dont really use any other media). i dont intend to change that either, even if it affects my career. so, before diving in, i wanted to know if its even possible to work in such a field… im a noob, sorry if this is a dumb question.

i have linkedin and instagram!!! im mainly talking about twitter/X as its so mainstream right now…",False,0.52,https://www.reddit.com/r/datascience/comments/15bybfg/do_you_need_to_have_any_social_media_to_be_a_data/,datascience
10 years+ in Data Science and I am stuck,15b0fff,Comfortable_Brick_70,1690460423.0,,False,True,Career,122,False,193,"Currently work as a Data Science Tech Lead in an Insurance AI lab with 20+ data scientist. Overlooking 3 squads, coaching senior DS & maintaining technical quality. The lab mainly do NLP research & projects are interesting.

It sounds great but I feel depressed & pessimistic with the career outlook.

I worked my way up from data analyst (excel) to ML Scientsit (building NLP model) to DS tech lead (governance).

The higher the career ladder, the fewer chance for me to actually write code & touch the data, and instead I mainly talk to architect, draw diagram & give high level comments on sprint review.

The worst is...the decline in technical skill, and the invisible ceiling of career.

Data Scientist is never (really) the bread & butter of a company. Yes we can build ML model that generate business value, but rarely the core business.

That also means up to certain level, the only way up is to manage people & focus on the business side.

The coming trend of LLM is worrying too (for all DS working in NLP)

I could be wrong (or just too pessimistic)",False,0.84,https://www.reddit.com/r/datascience/comments/15b0fff/10_years_in_data_science_and_i_am_stuck/,datascience
Switching career to data science,15c2n7x,Advanced-Witness-752,1690562856.0,,False,True,Career,1,False,0,"As the heading indicates I am thinking about switching my career from agriculture to data science. 
One thing I noticed about myself that I am good in statistics, excel, statistix 8.1 and spss. I also know a fair bit about data analysis in research. 

Should I consider it as a career ? Any data science expert here . Please give me your honest opinion about it.
Thanks.",False,0.33,https://www.reddit.com/r/datascience/comments/15c2n7x/switching_career_to_data_science/,datascience
Talk Python to me podcast on Shiny,15bwezd,StrangeGanache2050,1690548171.0,,False,False,Tooling,0,False,2,,False,0.67,https://talkpython.fm/episodes/show/424/shiny-for-python,datascience
AI tool for cleaning text data,15bwbbq,WhatMerlot,1690547897.0,,False,True,Tooling,3,False,2,"Open to suggestions for a tool I can use that will clean thousands of product listings by removing special characters, unnecessary spacing, and ensuring all sentences are complete, sound natural and contain the correct grammar? 

By product information I mean descriptions, ingredient, how-to-use, (etc.) attributes of saleable retail product listings.

Thanks!",False,1.0,https://www.reddit.com/r/datascience/comments/15bwbbq/ai_tool_for_cleaning_text_data/,datascience
Advice for finding Headhunters,15c1we5,Gelatin-Frogs,1690561091.0,,False,True,Career,3,False,0,"I currently  work in data science/computer vision for the biomedical field. Recently I’ve been looking to change jobs, but haven’t had much success cold applying to job posting that I see on boards. 

Some people I know in other industries recommended I try using a headhunter to help me get a placement, but they didn’t know any headhunters or firms that specialized in my field. 

I’ve received recruiter emails before but many seem very sketchy, and google searching for good headhunters doesn’t seem like a strategy for success — just to find the recruitment agency with the best SEO. 

I was wondering if people had any good experience with headhunters in this field that they would recommend. Or advice if there are better options than headhunters for data science. 

Thanks!",False,0.33,https://www.reddit.com/r/datascience/comments/15c1we5/advice_for_finding_headhunters/,datascience
Real time object detection using Jetson Nano,15c01nv,Smooth-Ad1528,1690556836.0,,False,True,Projects,0,False,1,"Real-Time-Object-Counting-by-Jetson-Nano

[https://github.com/R-Mahmoudi/Real-Time-Object-Counting-on-Jetson-Nano](https://github.com/R-Mahmoudi/Real-Time-Object-Counting-on-Jetson-Nano)",False,1.0,https://www.reddit.com/r/datascience/comments/15c01nv/real_time_object_detection_using_jetson_nano/,datascience
How well would my domain specific data experience in civil engineering hydraulics be received while searching for more general data science jobs?,15bzk4p,esperantisto256,1690555736.0,,False,True,Career,1,False,1,"I have a rather domain-specific data science experience, but I’ve been wondering how far it could get me more generally in the search for data science jobs. 

I did a civil engineering undergrad and am currently starting a masters in water resources engineering. I chose this field because I got really into numerical methods and programming in my degree. I’ve done a fair amount of stats, linear algebra, and Python/MATLAB/R/Java in my degrees, with some ML. 

In my domain, I focus on numerical hydrodynamic/hydrologic modeling and CFD. My thesis will be incorporating ML into the modeling process to help improve the accuracy of certain models given the huge array of data now available. (The CFD work can take months to run on a computer, so there’s interest in finding more data-driven approaches rather than pure hydrodynamics). 

So my masters thesis will essentially be a fairly comprehensive ML project jumping off applied math/physics. I’ll also have a fair assortment of relevant math/CS classes by then as well, although they’re slightly domain specific.

How hirable would I be for more general data science positions? I know the market is rough right now and I don’t want to get too optimistic. Just wondering what options are out there and how I could make myself more generally attractive to employers. I’ve been considering further education beyond the MS in a more typical data field, but still debating what exactly.",False,0.67,https://www.reddit.com/r/datascience/comments/15bzk4p/how_well_would_my_domain_specific_data_experience/,datascience
"I died in 2019 and was reborn for DS. Should I represent my past life on my CV, and how?",15bnnq8,synthphreak,1690519856.0,,1690546289.0,True,Career,22,False,4,"For the first decade-ish of my career I worked in education (edit: not as a teacher) doing things utterly unrelated to STEM. Then in 2019, I made a hard pivot towards DS, jettisoning everything I knew and had worked towards in search of a better future. [Since that time I have found considerable success](https://www.reddit.com/r/datascience/comments/13pos9d/selftaught_coder_in_first_role_want_to_job_hop/?utm_source=share&utm_medium=web2x&context=3), accruing a good variety of diverse skills and experiences. But as I consider finding my second DS* position, this backstory presents a slight dilemma.

I just updated my CV, cutting out *everything* that's not relevant to DS, except for my undergrad and grad degrees. In its place, under ""*Recent* Work Experience"" I went all out listing absolutely every little thing I have done since 2019. But then I realized that this leaves a huge chunk of time unaccounted for on my CV. Someone who looks at it might think ""Great, this guy meets DS requirements X Y and Z - but damn, what was he in prison for a while or something?"" Lol. There's just no way for them to know what I spent the years between school and 2019 doing, based only on the info in this DS CV.

My rationale for cutting so much was obviously the concern that it would add nothing to the strength of my application, and perhaps even make it weaker. I also *really* want to stay away from the field of education... But now I'm questioning this decision, and wondering if there is still some merit to mentioning - even if only briefly - all the other stuff I've done. If for no other reason than to show that I have in fact been gainfully employed for my entire adult life.

With the large number of people who have entered DS later in life or through non-traditional routes, surely I'm not the only person who has faced this. What are your thoughts? What have you seen?

\* Technically my field is ML engineering, not stats or DS proper. But there is obviously huge cross-over between all these, and anyway this detail is irrelevant to my question, so I'm not splitting hairs.

---------

**Edit: Important clarification -** It wasn't like I moved from pumping gas into DS. The jump wasn't *that* extreme. Rather, pre-2019 I was working in language education, and now I work in NLP. So interest in language is the common thread. It's just that my previous work had nothing to do with coding, math, stats, data, or anything remotely DS-like. Although the domain has always been language, the minimum viable skill sets for my pre- and post-2019 work are completely non-intersecting.

**Edit: Less important -** “Education” here does not mean “teaching”. Sorry for the confusion. I was a researcher actually, focusing on standardized testing, classroom interventions, and other things of import to students and teachers alike. Either way, the content of the job was of no relevance to ML engineering, my current job.",False,0.58,https://www.reddit.com/r/datascience/comments/15bnnq8/i_died_in_2019_and_was_reborn_for_ds_should_i/,datascience
Free API or csv's for historical residential real estate data?,15bkyy5,gotta-earn-it,1690511498.0,,False,True,Projects,2,False,4,"Hi, I'm trying to start a data viz project to learn from , but having a hard time finding sources. I applied to the Zillow/Bridge API but got rejected. Not sure if RapidAPI is a good site to use? It seems I can get access to Realtor.com or Zillow through them, but at only 500 or 45 calls per month, respectively. I also found an excellent dataset from the state of CT that goes back 20 years, but would love if I could find at least 2 more states.

Ideally I'm looking for things like square footage and # of bedrooms. And ideally the sale prices or values for multiple decades. This is for a learning project.",False,0.71,https://www.reddit.com/r/datascience/comments/15bkyy5/free_api_or_csvs_for_historical_residential_real/,datascience
Dara Science certification,15bhrsw,davealexis97,1690502492.0,,False,True,Education,1,False,7,"

So CompTIA has a new data science certification coming out, and I am thinking about taking it while it is in the beta testing phase. Being that it is not out yet, there is no specific training, from CompTIA themselves or another source, for this exact cert yet. Anyone know of any general good ideas to study for this certificate ?",False,0.82,https://www.reddit.com/r/datascience/comments/15bhrsw/dara_science_certification/,datascience
"Villages, Cities, States, Countries database of the world, and crops grown in that country database recommendations wanted",15bt18f,P_H_i_X,1690538244.0,,False,True,Discussion,0,False,1,"I have found a few DBs,  
[https://github.com/dr5hn/countries-states-cities-database](https://github.com/dr5hn/countries-states-cities-database)

[https://simplemaps.com/data/world-cities](https://simplemaps.com/data/world-cities)

I am currently using this, [https://download.geonames.org/export/dump/](https://download.geonames.org/export/dump/) , for villages, cities, etc. But I still need a better exhaustive db for crops grown in a specific country.

I was wondering if there existed better DBs for the same. Especially the crops that are grown in a specific country, the FAO one is very broadly defined, for example, fruits and vegetables are just classified as fruits and vegetables but I want them to be exhaustible.

&#x200B;

Also would love to know how you guys search for a specific database for a very specific topic. I am in college right now and would love to make acquiring data a bit less of a tedious task.",False,1.0,https://www.reddit.com/r/datascience/comments/15bt18f/villages_cities_states_countries_database_of_the/,datascience
Technical vs Statistical vs Domain,15c1am2,,1690559706.0,,1690560046.0,True,Discussion,14,False,0,"So, peeps.

What is the most in demand skill for a data scientist, in your opinion?

1. The technical skills, such as the ability to productionize ML models as well as knowledge of big o notation, distributed systems and security.
2. The statistics skills, namely traditional statistics such as experiment designs, hypothesis testing, A/B test, sampling, bootstrapping
3. Domain knowledge, including business knowledge and understanding - allowing you to see \*WHAT\* problems to solve to generate profit and why.

Personally, I believe most companies prefer someone who is more technical than a statistician, because a model that can't be deployed and integrated into a real system, provides 0 value. I also think that people who have the domain knowledge trumps both, as long as they have enough skills to provide good-enough models.

And let's be honest, 80% of data scientists couldn't code their way through an interval scheduling question even if you put a gun to their head. And that is the same as failing addition in math.

But then again, I am a machine learning engineer in Europe, and from what I can see, data scientists in the US are closer to traditional statisticians than multi-disciplinary CS,DS people.",False,0.38,https://www.reddit.com/r/datascience/comments/15c1am2/technical_vs_statistical_vs_domain/,datascience
Book Recommendations?,15bs9ww,ibbi1020,1690535678.0,,False,True,Education,2,False,1,"Hi, I'm leearning data science on the side before freshman year of University begins. I was wondering if anyone has any good book recommendations to learn data science from scratch. 

I need help with statistics, popular libraries and all the core concepts that come with DS. Any recommendation is helpful :)",False,1.0,https://www.reddit.com/r/datascience/comments/15bs9ww/book_recommendations/,datascience
How's the job market?,15b5uiy,SuchExplanation,1690473998.0,,False,True,Discussion,29,False,17,"Has the job market gotten any better? A few months ago, my interview rate was 10 out of 50 jobs applied. Now I'm getting 0 interviews out of 20 jobs applied... just wondering what your experience has been?",False,0.77,https://www.reddit.com/r/datascience/comments/15b5uiy/hows_the_job_market/,datascience
Masters in Data Science,15bbuxv,Wide-Ad5586,1690488162.0,,1690500570.0,True,Career,29,False,6,"I'm a recent graduate of Bachelor's in Data Science and Business analytics. 

 I'm currently planning to pursue my data science masters abroad.
Out of all the countries I really like the idea of pursuing it from Germany.

The different options I had were : 
USA : Dropped it because it's too expensive
UK : No job guarantee + Post study work visa duration is less
Australia : Expensive

The only option I now have is Germany and I'm really liking it. (I don't mind learning German)

Which countries would you suggest?

And any opinions on doing MS DS from Germany?",False,0.64,https://www.reddit.com/r/datascience/comments/15bbuxv/masters_in_data_science/,datascience
I need help with AI Cover,15bxyfi,EleTriCTNT,1690552024.0,,False,True,Projects,0,False,0,Does anyone know how to do ai cover but with voices of real people of our choice?,False,0.17,https://www.reddit.com/r/datascience/comments/15bxyfi/i_need_help_with_ai_cover/,datascience
Looking for DS professionals’ perspectives on DS at the high school level,15b4l15,SpicyMayoJaySimpson,1690471044.0,,False,True,Education,107,False,17,"I’m a high school math teacher, and my boss is trying to get an Intro to Data Science course ready to launch in the 2024-25 school year. I don’t have much of a DS background (so I’m not sure that I’m the best person to help design this course, but we play the hands we’re dealt)

He’s giving me and a colleague a lot of free reign in designing this, but there’s a boundary he’s set that I think will make this endeavor hard: he wants the course in the math department, not the computer science department, so it wouldn’t be co-taught with CS teachers and would not have a CS prereq. Extending that, the course we design should be very Python-lite or even Python-free. He basically told us that we should build this course to be accessible to kids who have no coding experience whatsoever 

My concern is that this would severely limit our ability to make a meaningful, rigorous course. The more I dive into everything, I feel like the coding aspects are an integral part of the field. I’m not convinced that you can get by with just excel, codap, etc. It already feels like the black box of ML will be impossible to teach, and I don’t know how I feel about watering down the technical aspects to that degree 

So my questions really are:

1. Do you think coding (Python) is a necessary element to a student’s first year exploring data science? If so, to what degree?

2. Outside of coding, what do you feel are the most critical topics that must be included on a course like this? I’ve already decided that we need to spend a good amount of time on privacy and data ethics before they actually touch datasets 

Thanks for any help y’all can give",False,0.84,https://www.reddit.com/r/datascience/comments/15b4l15/looking_for_ds_professionals_perspectives_on_ds/,datascience
