title,id,author,created_utc,distinguished,edited,is_self,link_flair_text,num_comments,saved,score,selftext,stickied,upvote_ratio,url,subreddit
How do I negotiate a better salary in a DA position?,152aw2n,_unbanned_datum,1689620907.0,,1689621130.0,True,Career,7,False,2,"Hello,

Title says most of it, I’m a Data Analyst but working directly under the C-Suit and being the companies only data analyst I end up doing so much more. 

I regularly work with APIs from Google Ads, Facebook Ads, GA4, etc. to enrich our data for custom reports. Many times, I am designing databases (typically Postgres but some old ones are on SQLite3) to store this data and power reporting infrastructure that I built. I taught myself Prefect for this job, and I build reporting automations with it as well.

Many times I am communicating directly with our database leads, server leads, Android leads, iOS leads, web leads, and various project managers to orchestrate a plan which I’d formulated to meet some reporting requirement. 

For one example, advising our Android team to send app-instance referrer data to our database upon successful registration. Then I had our database team make adjustments to store this information alongside other user registration data. Then I would go into Google Ads and configure our ads to correctly insert this data in the right spots of our ads. Then I configured an automation to automatically generate reports and distribute them at specific times. So I’m managing this entire pipeline, for one example, that includes every single one of our company ads, all of our client apps, unique customer attribution methodologies for each client, standardization on the server side, storage and automated reporting.

Quite often, when there’s a reporting need, they task me with it and it’s my job to make data sense from their business requirements. Then that’s plan it all out and orchestrate it. I also lead a meeting dedicated to showcasing our stakeholders company progress since last meeting. 

All of this, and I was hired at $56,000 approximately one year ago. This was my first job in this career first, and probably my 50th interview, so I saw it as a great opportunity despite the lower pay and took it.

Now, I think it’s appropriate to negotiate a higher pay. The problem though, first, is that I do not really know what I am here and therefore what my expectations should be. I feel like a data analyst engineer perhaps, but I’m not sure of that. I do not, however, think it is still appropriate to base my salary solely on that of my areas Data Analysts.  
Second issue is that I’m not sure how to negotiate well. Should it be in person, and how should I initiate this?

Last problem, does it make a difference if my company doesn’t make a lot (or any) profit at the moment, as a for profit company?",False,1.0,https://www.reddit.com/r/datascience/comments/152aw2n/how_do_i_negotiate_a_better_salary_in_a_da/,datascience
"Data scientists in Orlando, how much are you making?",15271qz,New-Anteater7520,1689612112.0,,False,True,Discussion,1,False,3,"I’m just curious of how much a data scientist in the Orlando area can make. And if there are many, or a few. 

Glassdoor estimates an average of $136k, do you confirm?",False,1.0,https://www.reddit.com/r/datascience/comments/15271qz/data_scientists_in_orlando_how_much_are_you_making/,datascience
From SRE to Data science or analytics,152a9mn,ShotPeach6365,1689619494.0,,False,True,Discussion,1,False,2,"I just quit my sre (like devops) job today, I'll be doing some studying over the next few months then in October / December will start applying for data analytics jobs. My end goal is data science I just think maybe I have a higher chance to get a data analytics job then move to data science.

I have a Master's in Mathematics (analytics). 5 years of experience in an investment bank. My skills include: sql, tableau, qlik, splunk, statistics, unix, incident management, Microsoft (azure, excell...), Python is at a beginner level though.

In the next few months I am looking to work on my python ( mainly pandas, matplotlib, seaborn), work more on SQL even though I am advanced level but from what I saw it seems like one of the top important skills for data analytics. I will also be reviewing statistics methodologies as it's been a couple of years since I worked with it.

Is that fine? If anyone has any advice for me I would be very appreciative.
Did anyone go through such a transition before? I would like to hear more about your experience",False,1.0,https://www.reddit.com/r/datascience/comments/152a9mn/from_sre_to_data_science_or_analytics/,datascience
People who worked as data scientists and then went back to get masters in DS. Why and what did you learn?,151vh6u,Professional-Site977,1689580854.0,,False,True,Discussion,9,False,15,"Hello, so I have 1 year of experience as a data scientist and want to know about the experience and thought processes of people who went back to pursue masters or phd in their fields. What learnings did you gather and was it worth it and should i also explore and what was the main reason you did this?",False,0.89,https://www.reddit.com/r/datascience/comments/151vh6u/people_who_worked_as_data_scientists_and_then/,datascience
"Recommendation for basic statistics, regression, time-series, and machine learning models for a medical student with basic background in Statistics",1527me8,Foreign-Ad-4997,1689613422.0,,False,True,Education,2,False,2,"Hey everyone!

I am a medical student who has a very basic background on statistics. In specific, I did perform Mann-whitney U test, t-test, ANOVA Kruskal Wallis with post-hoc analysis on different medical datasets using Statistica and R Studio but most of which was done using tutorials online and was supervised by a biostatician. I have never done statistics in high school or university but did advanced calculus so I have a great understanding in Maths.

I would like to deepen my knowledge in basic statistics, and then regression, time-series, and  machine learning models, preferably on R but Python is also possible. Can anyone please recommend me books and/or online courses that would help me in this?

&#x200B;

I know these are huge topics with different resources but I wanted to be as specific as possible

Thank you in advance for your help and answers!!",False,1.0,https://www.reddit.com/r/datascience/comments/1527me8/recommendation_for_basic_statistics_regression/,datascience
Data Science Interview,152ckrv,justdoit0002,1689624717.0,,False,True,Discussion,0,False,1,"Hey!! 
I am looking for any group dedicated for data science interview and preparation.",False,0.99,https://www.reddit.com/r/datascience/comments/152ckrv/data_science_interview/,datascience
Am I underpaid or is it ok?,151fhor,Ok-Ad-561,1689536613.0,,False,True,Career,59,False,75,"Hi, I’ve been recently wondering if I’m getting underpaid at my job or if my salary is ok.

I work as a Data Scientist at a small company in western Massachusetts, near Springfield MA. I started working here after graduating college May of 2022- my degree was in Math and Philosophy. When I started work in October 2022, I was only guaranteed 3 months at the job. I was being paid 15$ an hour for the first month (this was like a onboarding period). Then once I settled, it got increased to 18$ per hour. After the 3 months, I got a further salary bump to 24$ an hour. 

This April (6 months into the job), I negotiated my salary for a raise for the first time. Being my first ever salary negotiation, I feel like I kinda undersold myself. There was a bit of a confusion on the final agreement, but basically my salary was increased to 70k per year (33.65$ an hour).

Overall, I think this is a good salary. Especially when I look at where I was compared to where I am now, and the cost of living in this areas, there’s a lot to be thankful for. As a international student I got really lucky to find a job in the nick of time. But, I’ve done a lot of good work here - in fact I do more Data engineering and software engineering than data science, and I do everything from controls engineering to database management to software development to Statistical analysis. When I look at the pay for data scientists in the market, idk if I’m being underpaid. I wonder what you all think.",False,0.88,https://www.reddit.com/r/datascience/comments/151fhor/am_i_underpaid_or_is_it_ok/,datascience
Regression for applied machine learning,152acld,sabber_ahamed,1689619677.0,,False,True,Education,0,False,1,"📊💡 Understanding the fundamentals of statistics and data analysis, such as regression, is crucial for data analysis, machine learning model development, and many real-life applications. It's like learning the alphabet before writing essays!  


I just compiled a guide that demystifies these basic yet powerful concepts with easy-to-understand language, intuitive examples, Python code, and visualizations.  


Check out the guide here: Feel free to share your thoughts, ask questions, and let's spark some insightful discussions!

&#x200B;

[https://www.linkedin.com/posts/sabber-ahamed\_regression-for-applied-machine-learning-activity-7086716509401595904-K3Av?utm\_source=share&utm\_medium=member\_desktop](https://www.linkedin.com/posts/sabber-ahamed_regression-for-applied-machine-learning-activity-7086716509401595904-K3Av?utm_source=share&utm_medium=member_desktop)",False,1.0,https://www.reddit.com/r/datascience/comments/152acld/regression_for_applied_machine_learning/,datascience
Disabling selective topics in BERT topic model,15247ov,PlacePositive3840,1689605706.0,,False,True,Discussion,2,False,2,"Hi, 
I have trained a BERT topic model with 15 clusters, I want to remove/disable a specific cluster while using it for predictions. How do I do that?",False,1.0,https://www.reddit.com/r/datascience/comments/15247ov/disabling_selective_topics_in_bert_topic_model/,datascience
Preparation for Data Science Interviews,151xaug,1DimensionIsViolence,1689587113.0,,False,True,Career,6,False,5,"Currently, I am preparing for data science interviews. The ""An Introduction to Statistical Learning"" and ""The Elements of Statistical Learning"" are the best resources to prepare for interview questions I know (let me know if you have a better resource/strategy for preparation). 

I am wondering which of the two books I should choose for my preparation as the latter goes deeper into the mathematical aspects but at the same time I would prefer the former as there is a Python version and it is easier to read imo.

Which one would you recommend?",False,1.0,https://www.reddit.com/r/datascience/comments/151xaug/preparation_for_data_science_interviews/,datascience
Career change to data science,1528un9,No-Volume7139,1689616239.0,,False,True,Career,2,False,1,"I am considering a career change to data science or analytics  and need advice . I was talented at maths in school but did a degree in political science. Since then I have worked in policy and public affairs for a couple years. However I've always been interested in and more comfortable working with data, and would like to pivot my career towards this. I am considering a masters degree in data science and analytics. 

My question is, how difficult would it be to get a junior data science or analytics job with a masters, but with no work experience in the field and a social science undergrad? Is the masters alone enough to enter the field?",False,0.67,https://www.reddit.com/r/datascience/comments/1528un9/career_change_to_data_science/,datascience
Discover how to create an awesome AI chess engine with your DS knowledge,1528tf0,Artistic_Highlight_1,1689616164.0,,False,False,Projects,0,False,1,"Want to use your data science knowledge to create an AI chess engine? Check out the linked article, to make an AI chess engine the way AlphaZero did!",False,1.0,https://python.plainenglish.io/learn-how-to-train-your-awesome-self-playing-ai-chess-engine-77a46633a949,datascience
"When they ask - ""You should know AWS"" - what do they really mean?",151uo14,jaegarbong,1689578053.0,,False,True,Discussion,3,False,6,"AWS is such a massive topic - they couldn't possibly expect a candidate to be like a AWS Architect or something, is it? 

Personally, my experience with AWS was that my client had their Jupyter notebooks synced with Bitbucket and S3 buckets. So at max, I can claim that I know something about AWS Sagemaker and S3.  But that's not really true.

So what does an aspiring data scientist ought to do or mention in their resume?",False,0.88,https://www.reddit.com/r/datascience/comments/151uo14/when_they_ask_you_should_know_aws_what_do_they/,datascience
Not able to import bacpac files,1527vo7,Ecstatic-Cat-5830,1689614009.0,,False,False,Projects,0,False,0,,False,0.5,https://i.redd.it/x9pswc0x5kcb1.jpg,datascience
My current bad performance in my Data Entry position 2 months in is making me feel inadequate about my data science career pathway,1527cyu,Javilism,1689612839.0,,False,True,Discussion,3,False,1,"I am a graduate student pursuing data science as my Masters and I currently have a 4.0 in the program. I have done well on all my R, SQL, Python assignments as of now.

However, I recently started a data entry position at a biotech research clinic and 2 months into the job, I am already being told that I am making a lot of mistakes even though most of the mistakes that I have been making were like 3-5 incorrect data points within a large ocean of data that has to be inputted. I have been told that if I don't improve by the upcoming month, I will be terminared despite only being there for 3 months.

Because of this, I feel that I may be too inadequate to pursue data science because I am creating messy data in the system. This has been accompanied by me having overwhelming anxiety about my future as well.",False,1.0,https://www.reddit.com/r/datascience/comments/1527cyu/my_current_bad_performance_in_my_data_entry/,datascience
🔬 Automating Entity Extraction from Safety Data Sheets (SDS) using LLMs - Leveraging Zero-Shot Labeling! 🔬,152d931,UBIAI,1689626227.0,,False,True,Education,1,False,0,"🔍In the ever-evolving landscape of modern technology, automating entity extraction from PDF documents has become a game-changer in various applications. One essential domain is Safety Data Sheets (SDS) used for chemical management.   
Let's dive into how this automation can revolutionize the way we handle critical information! 🚀  
  
In this article, you'll learn about the process of automating entity extraction from Safety Data Sheets (SDS) using Large Language Models (LLMs) and leveraging zero-shot labeling. 📚 The article covers the importance of entity extraction in SDS management, the benefits of using LLMs for this task, information extraction from SDS using zero-shot and few-shot labeling with GPT 3.5 (ChatGPT), and the implementation of automated entity extraction with UBIAI and OpenAI's GPT3.5 Turbo API. 💡  
  
The article also highlights the benefits that SDS companies can gain from adopting automated entity extraction, including saving time, improving accuracy, enhancing compliance, and enabling quick retrieval of critical information for more efficient chemical management. 🏭💼  
  
  
Read the article here: \[https://medium.com/ubiai-nlp/automating-entity-extraction-from-safety-data-sheets-sds-using-llms-e4dee4a74140 \]  
  
Happy reading! 📖  
",False,0.25,https://www.reddit.com/r/datascience/comments/152d931/automating_entity_extraction_from_safety_data/,datascience
Building Data Science Foundation at a Think Tank - Your Suggestions?,1526zzr,Local_Order6899,1689612003.0,,False,True,Career,0,False,1," *Didn't get any responses so I am trying again.*

&#x200B;

Currently a PhD candidate in Philosophy. I’ve somehow managed to land a position at a public policy/economics  think tank where I juggle roles as a researcher and undergrad research mentor. How can I leverage this work towards a career in data analytics/engineering/science?

My work involves handling lots of data, drafting academic papers (as part of a team) and creating dashboards/visualizations. Lots of descriptive stats stuff, but some projects involve more inferential stuff. But since my formal academic background itself isn't data-centric, I need your insights on gaining demonstrable and competitive data skills.

I think there are lots of skills I can develop at the think tank, and they are very open to letting me work on whatever projects I want - improving data management, enhancing leadership skills with interns, academic pubs, learning new tools like SAS (widely used in my organization), GIS, or even pursuing a funded MA in applied economics or statistics. I can't seem to pinpoint the most impactful path.

Hence, here I am, asking you experienced data professionals for advice. What would be the best stepping stones to transition into data science, data engineering, or data analytics from my current position? Any and all advice is highly appreciated!",False,1.0,https://www.reddit.com/r/datascience/comments/1526zzr/building_data_science_foundation_at_a_think_tank/,datascience
"Weekly Entering & Transitioning - Thread 17 Jul, 2023 - 24 Jul, 2023",151r0hu,AutoModerator,1689566483.0,,False,True,,97,False,10," 

Welcome to this week's entering & transitioning thread! This thread is for any questions about getting started, studying, or transitioning into the data science field. Topics include:

* Learning resources (e.g. books, tutorials, videos)
* Traditional education (e.g. schools, degrees, electives)
* Alternative education (e.g. online courses, bootcamps)
* Job search questions (e.g. resumes, applying, career prospects)
* Elementary questions (e.g. where to start, what next)

While you wait for answers from the community, check out the [FAQ](https://www.reddit.com/r/datascience/wiki/frequently-asked-questions) and Resources pages on our wiki. You can also search for answers in [past weekly threads](https://www.reddit.com/r/datascience/search?q=weekly%20thread&restrict_sr=1&sort=new).",False,1.0,https://www.reddit.com/r/datascience/comments/151r0hu/weekly_entering_transitioning_thread_17_jul_2023/,datascience
Any Materials + Advice on how to pass the Databricks Machine Learning Associate Exam,151wd3n,No_Conversation_2474,1689583915.0,,False,True,Education,4,False,4,"My company recently switched to using Databricks (a small company with around 50 employees) and was instructed to learn Spark and general machine learning on Databricks(MLFlow, Ray, etc). So I have decided to get both certifications (Apache Spark and the Machine Learning Associate test).   


I recently got the Spark certification using the official training from Databricks (provided by the company) and a few practice tests - [practice\_test](https://www.udemy.com/course/databricks-certified-developer-for-apache-spark-30-practice-exams/) \- used this to test my knowledge and this one just before the test [Spark-exam-dumps](https://www.udemy.com/course/databricks-certified-developer-apache-spark-30-python/?referralCode=D20A15144B8AF7D2C5CF) had 80% of the same questions that were asked in the exam. So I just need help with the ML part.

I am honestly struggling to find any material to help me prepare for the test, I was able to find these two courses and of course the [Databricks Academy course](https://customer-academy.databricks.com/learn/learning_plan/view/11/machine-learning-practitioner-learning-plan).

\- [https://www.udemy.com/course/databricks-certified-machine-learning-associate-2023/](https://www.udemy.com/course/databricks-certified-machine-learning-associate-2023/) 

\- [https://www.udemy.com/course/mock-exam-databricks-machine-learning-for-beginner-2023/](https://www.udemy.com/course/mock-exam-databricks-machine-learning-for-beginner-2023/)

&#x200B;

Has anyone given the test and how did you prepare?",False,1.0,https://www.reddit.com/r/datascience/comments/151wd3n/any_materials_advice_on_how_to_pass_the/,datascience
Is my data fit for an ARIMA model,15251jx,thornnick,1689607572.0,,False,True,Projects,7,False,1,"I have transactional data from a cafe and I am in the process of using ARIMA to forecast future sales for some products, specifically Full English Breakfast. 

I am in the process of normalising my data to fit into an ARIMA model. I have summed the totally sales and week and taken the log of this (Figure). There is still a lot of noise here. Is this acceptable to model? Or do i need to further reduce noise?

Thanks

&#x200B;

https://preview.redd.it/jhu0k2timjcb1.png?width=392&format=png&auto=webp&s=cf2df11289b488c022adcbb58cdfb042fb5b81df",False,1.0,https://www.reddit.com/r/datascience/comments/15251jx/is_my_data_fit_for_an_arima_model/,datascience
How to add graph/chart for weighted averages in GDS,152516v,Omer-Habil,1689607550.0,,False,False,Discussion,0,False,1,,False,1.0,/r/GoogleDataStudio/comments/1524pyb/how_to_add_graphchart_for_weighted_averages_in_gds/,datascience
Has anyone been successful with applying time series forecasting on compositional data?,1524gwd,sri_asks,1689606256.0,,False,True,Discussion,1,False,1,I am working with data where each exogenous variable contributes a proportion to the dependent variable. So the sum of all the exogenous variables equal to 1. What time series models can I use that will allow me to take a matrix input instead of modeling each exogenous variable separately?,False,1.0,https://www.reddit.com/r/datascience/comments/1524gwd/has_anyone_been_successful_with_applying_time/,datascience
Seeking interview advice (Analytics Manager position),151oz40,career-throwaway-oof,1689560443.0,,1689562069.0,True,Career,12,False,11,"TLDR: having my first interviews for Analytics Manager positions (never been an Analytics Manager before) and would love to benefit from your advice as I prepare. 

—

Hey everyone! I’m a regular on this sub but posting under a throwaway to avoid being identified. 

CONTEXT: 
I’ve been unemployed since getting laid off from a Data Analyst position in late 2022. At first I was applying mostly to senior DA roles but got no interviews for these (like 0 out of over 100 apps). 

So I broadened my job search and have been applying to all DA roles (entry level, senior, lead), entry level DS, and Analytics Manager type roles. I get some interviews and have had a few final rounds, but no offers yet. 

This week I have two recruiter screens for Analytics Manager positions. Both are people manager roles at small tech-adjacent companies. It will be my first time interviewing for a people manager role within analytics/data science. 

ASK: 
For those who have been in or interviewed for Analytics Manager or Data Science Manager type positions, what did your interviews look like? What topics were covered, and what did you feel interviewers were looking for?

My prep so far has focused on general management philosophy, communicating with stakeholders, and prioritizing projects. Would love to get the group’s advice on what else I should spend time on. 

Here’s my background if it’s helpful: 
- 3 years experience as a DA
- 3 years research experience at a think tank
- 2 years experience managing a customer service team at a tech company
- masters degree in social sciences, but with a lot of technical coursework
- ABD phd",False,0.79,https://www.reddit.com/r/datascience/comments/151oz40/seeking_interview_advice_analytics_manager/,datascience
Unsure of future career,15242ck,hoverrcraft,1689605368.0,,False,True,Career,2,False,1,"Hello all,

I’m entering my final year of university (undergraduate, studying statistics and mathematics) and on track to graduate spring 2024. I built my own website, have uploaded multiple data analysis projects, ML projects, I have a certificate in data analysis from Google using Coursera, and will have a certificate in data analysis from university in SAS. I know python, R, SQL, SAS, and different IDE’s such as visual studio code, pycharm, JupyterLab (and notebook), and can pick up coding relatively easily. I’ll also be attending university part time for a graduate degree in statistics with a focus in ML and AI. I also have internship experience, as well as freelance work. However, with seeing the DS job market how it is now, I’m worried I won’t be able to find a job to start next summer, or that I’ll be underpaid and role I won’t want to be in. I plan to work in the US, as that’s where I’m from. My question is as follows: is the job market for data scientists and data analysts as bad as it seems? IE, will I be able to find a job that I can work full time for and pays well in a position I want, along with allowing me to do grad school part time?",False,0.67,https://www.reddit.com/r/datascience/comments/15242ck/unsure_of_future_career/,datascience
Backup careers?,15146z8,Eddy114,1689507846.0,,False,True,Discussion,111,False,142,"I am fully and happily employed right now, but I have still send out like 30-40 applications over the last few years. Just to see if I could get another data science job.  
Over all those applications I only got 2 invitations total. I stand currently with 7 years (5 proper) of experience and a masters degree in mathematics and I don't have the feeling, that if I was fired today I could get another data science job within 6 months.  
So my current thought is to focus on becoming employable in a different job/field. Getting into controlling or trying to transition a hobby into a job. Maybe even teaching.  
Do you guys have backup plans/ careers you persue? ",False,0.96,https://www.reddit.com/r/datascience/comments/15146z8/backup_careers/,datascience
