title,id,author,created_utc,distinguished,edited,is_self,link_flair_text,num_comments,saved,score,selftext,stickied,upvote_ratio,url,subreddit
"Weekly Entering & Transitioning - Thread 31 Jul, 2023 - 07 Aug, 2023",15e5iw6,AutoModerator,1690776089.0,,False,True,,28,False,2," 

Welcome to this week's entering & transitioning thread! This thread is for any questions about getting started, studying, or transitioning into the data science field. Topics include:

* Learning resources (e.g. books, tutorials, videos)
* Traditional education (e.g. schools, degrees, electives)
* Alternative education (e.g. online courses, bootcamps)
* Job search questions (e.g. resumes, applying, career prospects)
* Elementary questions (e.g. where to start, what next)

While you wait for answers from the community, check out the [FAQ](https://www.reddit.com/r/datascience/wiki/frequently-asked-questions) and Resources pages on our wiki. You can also search for answers in [past weekly threads](https://www.reddit.com/r/datascience/search?q=weekly%20thread&restrict_sr=1&sort=new).",True,1.0,https://www.reddit.com/r/datascience/comments/15e5iw6/weekly_entering_transitioning_thread_31_jul_2023/,datascience
"R programmers, what are the greatest issues you have with Python?",15g96dc,joaoareias,1690983500.0,,False,True,Education,262,False,169,"I'm a Data Scientist with a computer science background. When learning programming and data science I learned first through Python, picking up R only after getting a job. After getting hired I discovered many of my colleagues, especially the ones with a statistics or economics background, learned programming and data science through R.

Whether we use Python or R depends a lot on the project but lately, we've been using much more Python than R. My colleagues feel sometimes that their job is affected by this, but they tell me that they have issues learning Python, as many of the tutorials start by assuming you are a complete beginner so the content is too basic making them bored and unmotivated, but if they skip the first few classes, you also miss out on important snippets of information and have issues with the following classes later on.

Inspired by that I decided to prepare a Python course that:

1. Assumes you already know how to program
2. Assumes you already know data science
3. Shows you how to replicate your existing workflows in Python
4. Addresses the main pain points someone migrating from R to Python feels

The problem is, I'm mainly a Python programmer and have not faced those issues myself, so I wanted to hear from you, have you been in this situation? If you migrated from R to Python, or at least tried some Python, what issues did you have? What did you miss that R offered? If you have not tried Python, what made you choose R over Python?",False,0.96,https://www.reddit.com/r/datascience/comments/15g96dc/r_programmers_what_are_the_greatest_issues_you/,datascience
U.S. Hiring Managers: how diverse is your applicant pool?,15gezo5,dantzigismyhero,1690997124.0,,False,True,Discussion,42,False,38,"We are currently hiring for a mid-level DS and by my last check, we got a few hundred applicants, about 80-90% of whom were not US citizens or foreign nationals.

Firstly, I don't have a problem with this. My parents are immigrants and our team would never discriminate against any applicant based on race, culture, or even English proficiency. We are screening very fine applicants from China, India, Turkey, etc.

That said, I do wonder where all the native English-speaking American data scientists are at? AFAIK, SWE/SDEs are more diverse in this respect but I have found that DS is disproportionately populated by non-Americans. I suspect this might be because American masters/PhD programs tend to have lopsided demographic makeups but curious what others are seeing.",False,0.89,https://www.reddit.com/r/datascience/comments/15gezo5/us_hiring_managers_how_diverse_is_your_applicant/,datascience
Do I need a masters?,15gmte5,Odd-Company-1440,1691017084.0,,False,True,Education,4,False,5,"I am going into my second year as a statistics major. I’m interested in data science/analytics as a career, but I’ve seen a lot of posts where people say they land their first DS job after a masters. Is it possible to break into the field with just a stats bachelor? I’m also aiming to land an internship for next summer, so will having one or two of those under my belt after graduation increase my chances of a job straight out of college?",False,1.0,https://www.reddit.com/r/datascience/comments/15gmte5/do_i_need_a_masters/,datascience
How do you describe your job when someone asks what you do?,15gkc1y,briannalynn24,1691009333.0,,False,True,Discussion,24,False,5,"I recently got a job as a data scientist and I’m struggling to find a way to describe what I do that doesn’t make people’s eyes glaze over and respond “Wow, you must be really smart!”

How do you describe what you do in 2 or 3 sentences? Do you go into detail about that data you look at? Or just a generic overview?",False,0.86,https://www.reddit.com/r/datascience/comments/15gkc1y/how_do_you_describe_your_job_when_someone_asks/,datascience
How I quickly rose to senior data scientist and eventually senior data engineer.,15fqkuj,on_the_mark_data,1690928046.0,,False,True,Discussion,89,False,208,"TL;DR You need to drive outsized value beyond just your team. That means you need to interact with business stakeholders and consistently solve their business problems with data. The quicker you learn to effectively engage business stakeholders, the quicker you will promote.

If you only ""speak data"" to your stakeholders, you are setting yourself up for failure. You can escape this trap by learning to instead ""translate data"" to your stakeholders. Here's how:

The below means NOTHING to your business stakeholders and you won't get the buy-in you need to actually drive change and value in your respective organization.

""We should care about data quality!""

""We really need to consider creating a proper data model!""

""This data pipeline is a bottleneck for your dashboard!""

Instead...

1. Understand that data is extremely abstract, and most people are not trained to deal with this abstraction. For example, tell me about a single row in an excel sheet? Very easy to name off the fields. Now tell me about a thousand rows in an excel sheet... it's hard. This is exactly what your stakeholders are facing. This is why it's so hard for them to create meaningful requests and requirements.

2. Ask your stakeholders about the business context, the reason why the request is being made, and how the output will be used by the business. Ask probing questions about the business and not the data.

3. Use your domain expertise to map the business requirements to data requirements-- this is now your ""translation"" map for all future communications.

4. With this mapping you need to answer the following without ""speaking data"" to your stakeholder: a) what was the business challenge, b) what is the solution to this business problem, and c) how they can use this solution today. This stakeholder is going to pass this information on to others, so train them to be successful in that. When you help others win, you win as well!

The above sentence examples may look like the following:

""We are fined $X amount by regulators for every wrong record, with our current data we are expected to be fined $Y amount. We can avoid this enormous penalty by implementing Z process."" [Data Quality]

""The most recent board meeting had conflicting financial numbers presented in the deck. Both numbers were 'correct' depending on the tables used and which team was asked. We can prevent this from happening again by cleaning up the which tables can be pulled from and how the numbers are generated."" [Data Model]

""This dashboard has a two day lag, making daily check-ins with enterprise customers difficult. We can change the data pipeline SLA to one day and work towards meeting that SLA given the new business context."" [Slow Data]

Hope this helps!",False,0.86,https://www.reddit.com/r/datascience/comments/15fqkuj/how_i_quickly_rose_to_senior_data_scientist_and/,datascience
How to move to a role that does ML?,15gcx3q,SnooCats9612,1690992384.0,,False,True,Career,9,False,7,"I've been a DS for almost 4 years now but unfortunately none of my roles involved training ML models that are deployed in real life.

  
I've built some small self-contained models that were sort of case studies so my skills are limited to that; otherwise my work has focused mostly on data analysis with some (fairly simple) statistical analysis.   


I see all these job postings that require a skillset I don't have and more importantly I would like to have but was never given the opportunity to do it on the job.

What is a good way of getting those skills?

&#x200B;",False,0.82,https://www.reddit.com/r/datascience/comments/15gcx3q/how_to_move_to_a_role_that_does_ml/,datascience
Is javascript necessary to become a computer vision/machine learning engineer ?,15gm87x,AIKiller1997,1691015640.0,,False,True,Career,17,False,2,"I have never seen javascript on a job posting I have mostly seen python, C++ or Java but I talked to a full stack developer and he instructed me to learn javascript so I needed some advice from the industry experts. Is javascript needed for a engineer or a researcher role ?",False,1.0,https://www.reddit.com/r/datascience/comments/15gm87x/is_javascript_necessary_to_become_a_computer/,datascience
RANT - There's a cheating problem in Data Science Interviews,15flo97,forbiscuit,1690916881.0,,False,True,Discussion,160,False,285,"I work at a large company, and we receive quite a lot of applicants. Most of our applicants have 6-9 years of experience in roles titled as Data Analytics/Data Science/Data Engineering across notable companies and brands like Walmart, Ford, Accenture, Amazon, Ulta, Macy's, Nike, etc.

The nature of our interviews is fairly simple - we have a brief phone call on theory and foundation of data analytics, and then have a couple of technical interviews focusing on programming and basic data analysis. The interview doesn't cover anything out of the ordinary for most analysts (not even data scientists), and focuses on basic data analysis practices (filter down a column given a set of requirements, get a count of uniques, do basic EDA and explain how to manage outliers). 

All interviewees are told they can use Google as we don't expect people to memorize the syntax, but we do expect them to have at least working knowledge of the tools we expect them to use. The interviews are all remote and don't require in-person meeting. The interviews are basically screen share of Google Colab where we run basic analysis.

In our recent hiring spree, out of the 7 potential candidates we interviewed, we caught 4 of them cheating.

Given their profile, I'm a bit amazed that they resorted to cheating. Whether it was by having someone else on the call helping them answer the question, or having someone entirely different answer their questions, and other notable methods that I don't want to share that we caught while they were sharing their screens. I've learned from my colleagues that there are actual *agencies* in India and China who offer interview 'assistance' services.

At this stage, our leadership is planning to require all potential candidates to be local - this eliminates remote option. On the same token, those cheaters passing the recruiter screening are quite frankly just making it worse for people who are actually capable. Questions become more theoretical and quite specific to industry, scope of hiring will be limited to people within specific domains, and improptu coding tests will be given out without heads up to hinder people from cheating and setting up whatever they do to cheat.

/endrant",False,0.87,https://www.reddit.com/r/datascience/comments/15flo97/rant_theres_a_cheating_problem_in_data_science/,datascience
Disaster job or imposter syndrome?,15gabl3,mancityfan97,1690986354.0,,False,True,Career,15,False,8,"Hi all,

For context, I’ve been a DS for 2+ years and have an MSc in DS. My first role was with a company that was really behind the curve when it came to DS, models were built and run in notebooks, no level of production. I’d say it was half way between an analyst/DS role. I would spend a lot of time building models, but they often wouldn’t go anywhere or do anything (the CEO loved the idea of DS but clearly didn’t want to commit to supporting the team with any tools/training for productionization of models). 

This left me feeling like I was falling behind the curve and wasting time in this role. I applied (for about 6 months!) and recently landed a role in a tech company working in a really skilled team with a really good tech stack.

My issue is, I hate it. The job itself if interesting and individually the team are kind and supportive, but there is a really toxic work ethic and it’s not what I’m built for. There is a level of knowledge that is expected that I clearly don’t have. The role is a mix of DS/MLE which seems to be the norm nowadays. I can handle the DS side well, but it’s the MLE side that I don’t understand and don’t really have the motivation to learn right now. 

I’m now in this weird spot where I have this job that looks great on a CV, but I feel as though I should’ve had another role in-between this one and my previous one where I can learn MLE and be better prepared for the stress this role brings.

Has anyone else had this experience when you have landed a job that is perhaps beyond where you are in your career? I doubled my salary with this move but that has been the only positive I’ve found, I wake up every day dreading work!

I realise I’m in a lucky position to have this job so I hope it doesn’t seem like I’m whining, I would just like to know if this is common, thanks!",False,0.9,https://www.reddit.com/r/datascience/comments/15gabl3/disaster_job_or_imposter_syndrome/,datascience
How to calculate average customer lifespan (and LTV) if a chunk of the users are still on your platform?,15gpioy,Opposite_Medium_2384,1691024110.0,,False,True,Projects,0,False,1,"We're a healthcare company and trying to calculate the lifespan of an average customers. Lets say Jan 2022 we had 100 new patients. Of the100 new patients, 25 are no longer using our services (have not had a visit within the last 3 months) while the remaining 75 are still active patients and have had a visit within the last 3 months. 

&#x200B;

How would you calculate the average lifespan for that cohort or our patient base? If I just assume the lifespan of the 75 active patients are from Jan2022-Aug2023, I'd be shortchanging our calculation bc these users haven't churned out. 

&#x200B;

Thanks for the insights!",False,1.0,https://www.reddit.com/r/datascience/comments/15gpioy/how_to_calculate_average_customer_lifespan_and/,datascience
What is it like being a Data Analyst?,15gpifn,MattMass3,1691024089.0,,False,True,Career,0,False,1,"Hello,

I am 21 years old and I am majoring in Global Business with an emphasis on Information Systems Management and Business Analytics after graduating with my Associates. I wanted to ask other data scientists if this is a rewarding career? I have no experience in coding with python and that is something I hope to learn in this major, as well as working with Artificial Intelligence and Machine learning as the years go by. The main goal is to open my own Analytics Firm after working for people to learn the way the business works. I still have a long way to go, but my intentions are clear I want to be a businessman and run my own company one day. I know tiktok and instagram says that people my age should be multi millionaires, and that college is a scam. I don't believe that, in fact I think it is the opposite as good things come with time and consistency. ",False,1.0,https://www.reddit.com/r/datascience/comments/15gpifn/what_is_it_like_being_a_data_analyst/,datascience
"Recently Was Assigned to a Job Rotation, Feeling Extremely Overwhelmed",15gk7w6,GetFkedPlease,1691008960.0,,False,True,Discussion,0,False,2,"I work for a large tech company in the semi-conductor industry. I was an EIC (Engineer In Charge) running a team of engineers for about 7 years doing field service work (modifications, troubleshooting, and analyzing etch semiconductor equipment).

Two years ago I began schooling for Computer Science B.S. Last September, I was offered a new role as a Data Analyst II doing remote diagnostics for the same tools I work on while I finish my degree (same company). I've been doing that and enjoying it, finding trends in the data and offering suggestions, etc. To better serve our customer. 

As of July, I was offered,  and began, a job rotation program with our data science team that creates data products for our diagnostics team (us). The goal was to be able to learn from them for six months, and then be able to make better data products for our data analyst team going forward since the data science team serves multiple teams and sometimes our basic requests are postponed for months.

This is my first real week. I work a total of M-Thurs. Monday and Tuesday as my normal analyst role, Wed. and Thursday are my job rotation days. 

I am feeling WILDLY overwhelmed though. I have no enterprise SQL or Python experience, just little projects I've made for our team and on the side through schooling. Today, they were like, ""ok, your task is to create a script that takes in csv files and manipulates them to be better ingested in X data base, and triggers anytime the csv files are populated into Y folder."" I haven't even touched SQL in like a year. They set me up with Azure Data Studio, and there are like 8 servers we are connected to, some SQLserver, some PostGres, which I know nothing about. I also have to learn about sprints on Monday.com, Prefect.com flows and managing/ troubleshooting pipelines as they go down, Power BI dashboard issues, and a myriad of other things. PLUS, I have 15 data products that are currently excel macros our analyst team uses to analyze our tool logs for diagnostics stuff, that we want to convert to a single standalone application all wrapped into one. This was the main reason I was brought into the rotation.

The main goal of this was the transition of the data products, but now I'm being stretched across like 40 different things. 

Wednesdays, we have 6 meetings, all an hour or more long, essentially leaving me like a total of 13 or 14 hours to do all of this per week. 

Like holy shit. I am going to set up a meeting next week with the data science manager to better establish a flow and goals, because I think there is a huge misunderstanding or something. I don't know how in the hell they think this is normal. IS THIS NORMAL? 

I need like a month (basically four of the Thursdays) just to do YouTube refreshers/ learning about all these different platforms, SQL, Python, etc. Just so I have some clue what I am looking at. I need to shadow these people while they're troubleshooting so I can see some sort of process I can follow. I feel like I've been thrown to the wolves.",False,0.75,https://www.reddit.com/r/datascience/comments/15gk7w6/recently_was_assigned_to_a_job_rotation_feeling/,datascience
Data Career,15gn1sh,Illustrious_Fee_8167,1691017634.0,,False,True,Career,0,False,1,"\- I live in Turkey. I have recently graduated from Mechanical Engineering(Bachelor)

\-I want to pursue my education with Master degree at scientific computing. ( I will take data - ai courses )

Before starting it i have about 5-6 months. I want to start learning to make better transition.

I found the course ""Professional Certificate in Data Science"" from Harvard at Edx. Would you suggest this course or something else to find a job related data science and ai as soon as possible.

Also i found courses on coursera :

1. Machine Learning Specialization(includes : Supervised Machine Learning: Regression and Classification, Advanced Learning Algorithms, Unsupervised Learning, Recommenders, Reinforcement Learning)
2. Deep Learning Specialization(includes : Neural Networks and Deep Learning, Improving Deep Neural Networks: Hyperparameter Tuning, Regularization and Optimization, Structuring Machine Learning Projects, Convolutional Neural Networks, Sequence Models )",False,1.0,https://www.reddit.com/r/datascience/comments/15gn1sh/data_career/,datascience
Any ML professionals mind helping out with an academic survey?,15gmre3,cnorval,1691016939.0,,False,True,Projects,0,False,0,"Hi there,

I'm an academic at the University of Cambridge's Computer Lab, researching how organisations are recording information about their algorithmic systems.

If you're a professional working with algorithmic systems, and happen to have a spare ~20 minutes, would you mind answering some questions? The link to the questionnaire is here: https://cambridge.eu.qualtrics.com/jfe/form/SV_3n6RuowNogZKG34

Apologies if this kind of post isn't allowed. Feel free to delete if it's not!

Thanks very much!",False,0.5,https://www.reddit.com/r/datascience/comments/15gmre3/any_ml_professionals_mind_helping_out_with_an/,datascience
"For those actively looking for work — what percent reduction of your desired salary would you sacrifice to work remotely, if any? Especially curious for those with less than 5 years of relevant industry experience",15gluik,DJ_AbyB,1691014760.0,,False,True,Discussion,1,False,0,,False,0.4,https://www.reddit.com/r/datascience/comments/15gluik/for_those_actively_looking_for_work_what_percent/,datascience
Experiment with LLMs in our free hosted playground,15gk48y,hegel-ai,1691008737.0,,False,True,Projects,1,False,0,[https://prompttools.streamlit.app/](https://prompttools.streamlit.app/),False,0.33,https://www.reddit.com/r/datascience/comments/15gk48y/experiment_with_llms_in_our_free_hosted_playground/,datascience
autogpt The next AI wave after ChatGPT: Autonomous agents,15gk3c4,giorgiodidio,1691008677.0,,False,False,Discussion,0,False,0,,False,0.5,https://www.youtube.com/watch?v=AkR0bXhiU4E,datascience
How Inworld is using generative AI to create realistic NPCs for games,15gddzv,Agitated_Garlic8845,1690993443.0,,False,False,Discussion,0,False,2,,False,1.0,https://medium.com/p/49d2828f21b9,datascience
Do headhunters exist for epidemiology/data analysis positions?,15gd8wx,publichealth_epi22,1690993139.0,,False,True,Career,3,False,2,I'm about to enter my last semester of my MPH in Epi and am starting to look for jobs. Thanks!,False,1.0,https://www.reddit.com/r/datascience/comments/15gd8wx/do_headhunters_exist_for_epidemiologydata/,datascience
Datacamp,15gihby,National-Okra23,1691004991.0,,False,True,Education,1,False,1,Is DataCamp platform helpful for beginners or is just waste of time?,False,1.0,https://www.reddit.com/r/datascience/comments/15gihby/datacamp/,datascience
Fulltime Offer Negotiation Question,15ghcje,NounVerbAdjectiveNum,1691002403.0,,False,True,Career,20,False,1,"Hi all,

I’d love some input from y’all. So this summer I was employed as a data analyst intern at a Fortune 500 financial services company. I graduate in May 2024, and I’m fortunate enough to have received a full time offer from the company.

The position is in a MCOL area and salary is $70,000 with up to 10% yearly bonus. When I look on Glassdoor for analyst roles with 0-1 years of experience in the same location, it shows $60,000 avg salary with $8,000 additional pay. 

By all accounts it seems like this is a fair offer, however I’ve been told that 99% of the time it’s better to negotiate than not. Do I have negotiating power here? And if so what would be that process? I just received the offer letter via email and haven’t responded yet. I know that this company really likes me and my manager definitely wants me back, and I really love working there as well.

Sorry for the naïve question - this is my first real “big time” job and dealing with anything like this. Thanks in advance!",False,0.67,https://www.reddit.com/r/datascience/comments/15ghcje/fulltime_offer_negotiation_question/,datascience
